{
    "candidate_id": "001",
    "parent_version": "0.1.0",
    "provider": "default",
    "provider_version": "1.0.0",
    "model_identity": "default_model",
    "diagnosis_refs": ["074d41baf0ca2624c43a", "e8818b560ea31a653951"],
    "atomic_edits": [
        {
            "component": "prompt",
            "target_path": "skill.json",
            "hypothesis": "generated artifact omitted required task content",
            "expected_metric": "task content presence",
            "patch": "{\"tasks\": [{\"id\": \"task-013\", \"content\": \"Ensure all required tasks are included in the skill.json file.\", \"status\": \"pending\"}, {\"id\": \"task-016\", \"content\": \"Ensure all required tasks are included in the skill.json file.\", \"status\": \"pending\"}]}\""
        }
    ],
    "new_tests": [],
    "edit_budget": 1,
    "created_at": "2023-10-04T12:00:00Z"
}