{
    "candidate_id": "0.1.1",
    "parent_version": "0.1.0",
    "provider": "default",
    "provider_version": "1.0.0",
    "model_identity": "gpt-3.5-turbo",
    "diagnosis_refs": [
        "61a4d91417b79464220a69a38c099a4157d42435d4812f2985c3437bfc8059f6",
        "6ca418bbc4743270aac370edc86b95efabcce744f5e265d5920fa91be9dc1042",
        "e76a834cef85dd758628d509f26de795dfa5baafc4133f1d8ecfef25122210bc",
        "4d9040d2773631526aba7b8605f168aff9be17087d1919bdf7a2cff4f93c7b96",
        "1a9467809c126e3d9c0b168e581f214ece5958fe4e31058b72e7b7e212ae4573",
        "bbce09589b0b516d65996c4cc39f4b7ddb94505545f0c7ab7a95a0ebec4b5f3e"
    ],
    "atomic_edits": [
        {
            "component": "prompt",
            "target_path": "skill.json",
            "hypothesis": "generated artifact omitted required task content",
            "expected_metric": "required task content",
            "patch": "{\"marker_source\":\"required_text\"}"
        }
    ],
    "new_tests": [],
    "edit_budget": 1,
    "created_at": "2023-10-10T14:00:00Z"
}