{
  "candidate_id": "01D7G1Y5T123456789",
  "parent_version": "0.1.0",
  "provider": "default",
  "provider_version": "1.0.0",
  "model_identity": "gpt-4",
  "diagnosis_refs": ["1fee28c1ec95c75ff30b", "0a3f24727bdab03423d7"],
  "atomic_edits": [
    {
      "component": "prompt",
      "target_path": "skill.json",
      "hypothesis": "generated artifact omitted required task content",
      "expected_metric": "0.9",
      "patch": "{\"marker_source\":\"required_text\"}"
    }
  ],
  "new_tests": [],
  "edit_budget": 1,
  "created_at": "2023-10-05T12:00:00Z"
}