{"candidate_id": "0.1.0-1", "parent_version": "0.1.0", "provider": "default", "provider_version": "0.1.0", "model_identity": "gpt-3.5-turbo", "diagnosis_refs": ["3a3afdafa193f1afd8f2", "fac541196682fc937622"], "atomic_edits": [{"component": "prompt", "target_path": "skill.json", "hypothesis": "generated artifact omitted required task content", "expected_metric": "required task content present", "patch": "{\"marker_source\":\"required_text\"}"}], "new_tests": [], "edit_budget": 1, "created_at": "2023-10-09T14:48:00Z"}