{
    "candidate_id": "0.1.0-patch-001",
    "parent_version": "0.1.0",
    "provider": "default",
    "provider_version": "1.0",
    "model_identity": "1.0",
    "diagnosis_refs": ["4640a6caa5e395dc4022", "470769648c6a69f978ba"],
    "atomic_edits": [
        {
            "component": "prompt",
            "target_path": "skill.json",
            "hypothesis": "generated artifact omitted required task content",
            "expected_metric": "task content presence",
            "patch": "{\"marker_source\":\"required_text\"}"
        }
    ],
    "new_tests": [],
    "edit_budget": 1,
    "created_at": "2023-10-05T14:30:00Z"
}