{"candidate_id": "0123456789abcdef01234567", "parent_version": "0.1.0", "provider": "default", "provider_version": "1.0.0", "model_identity": "default_model", "diagnosis_refs": ["9865ebf2643b6c01c51e", "6a6382889ffd026604e7"], "atomic_edits": [{"component": "prompt", "target_path": "skill.json", "hypothesis": "generated artifact omitted required task content", "expected_metric": "The artifact now includes the required task content.", "patch": "{\"marker_source\":\"required_text\"}"}], "new_tests": [],"edit_budget": 1,"created_at": "2023-10-04T12:00:00Z"}