{"candidate_id": "01d4c8e91234567890", "parent_version": "0.1.0", "provider": "default", "provider_version": "1.0.0", "model_identity": "gpt-4", "diagnosis_refs": ["0d78a3311fd2f78c23ed", "013f101711599d5ad3af"], "atomic_edits": [{"component": "prompt", "target_path": "skill.json", "hypothesis": "generated artifact omitted required task content", "expected_metric": "a more comprehensive artifact", "patch": "{\"marker_source\":\"required_text\"}"}], "new_tests": [], "edit_budget": 1, "created_at": "2023-10-10T12:00:00Z"}